{
 "rules_version": 11,
 "proposal_date": "2026-09-24",
 "data_mode": "test",
 "client_name": "Solaris Energia",
 "opportunity": "Proteção e continuidade do portal do cliente",
 "code": "PROP-SOLARIS-2026-001",
 "opportunity_id": "SOLARIS-2026-001",
 "input_assessment": {
  "status": "sufficient",
  "missing": [],
  "reason": "O material identifica o cliente, os ativos (portal do cliente, APIs do app, duas origens) e necessidades concretas: mitigação de DDoS de aplicação, bloqueio de robôs na consulta de débitos e failover automático entre origens."
 },
 "catalog_fit": {
  "status": "fits",
  "requested": "Proteção contra DDoS de aplicação e robôs no portal e nas APIs, e failover automático entre datacenter e nuvem pública",
  "reason": "App & API Protector, Bot Manager Premier e Global Traffic Management do catálogo cobrem diretamente os pedidos."
 },
 "client_scope": {
  "type": "phased",
  "excludes_implementation": false,
  "source": "Ata de 22/09/2026, Beatriz: \"Queremos primeiro um assessment e desenho, e depois a implantação. Não queremos contratar a implantação às cegas.\"",
  "forbidden_in_committed": [
   "mudança em produção",
   "ativação em produção",
   "go-live"
  ]
 },
 "governance": {
  "engagement_type": {
   "state": "commitment",
   "value": "phased",
   "approved_value": "phased",
   "source": "E-mail de Vitor (Executivo de Contas, POPULOS) de 24/09/2026 09:14",
   "approved_by": "Vitor",
   "approved_at": "2026-09-24",
   "approval_record": "E-mail de Vitor (Executivo de Contas, POPULOS) de 24/09/2026 09:14",
   "mode": "test",
   "engagement_ref": "phased",
   "approval_quote": "Vitor (Executivo de Contas, POPULOS) — 24/09/2026 09:14\n> Aprovo para a Solaris Energia: engajamento em fases (phased), com Fase 1 de assessment e desenho contratada e Fase 2 de implantação opcional."
  },
  "license_supply": {
   "state": "commitment",
   "value": "revenda autorizada",
   "approved_value": "revenda autorizada",
   "source": "E-mail de Vitor (Executivo de Contas, POPULOS) de 24/09/2026 09:14",
   "approved_by": "Vitor",
   "approved_at": "2026-09-24",
   "approval_record": "E-mail de Vitor (Executivo de Contas, POPULOS) de 24/09/2026 09:14",
   "mode": "test",
   "engagement_ref": "phased",
   "approval_quote": "Vitor (Executivo de Contas, POPULOS) — 24/09/2026 09:14\n> Aprovo para a Solaris Energia: engajamento em fases (phased), com Fase 1 de assessment e desenho contratada e Fase 2 de implantação opcional. Aprovo também: as licenças Akamai serão fornecidas pela POPULOS por meio de revenda autorizada."
  },
  "warranty": {
   "state": "commitment",
   "value": "90 dias corridos após o aceite de cada fase",
   "approved_value": "90 dias corridos após o aceite de cada fase",
   "source": "E-mail de Vitor (Executivo de Contas, POPULOS) de 24/09/2026 09:14",
   "approved_by": "Vitor",
   "approved_at": "2026-09-24",
   "approval_record": "E-mail de Vitor (Executivo de Contas, POPULOS) de 24/09/2026 09:14",
   "mode": "test",
   "engagement_ref": "phased",
   "approval_quote": "Vitor (Executivo de Contas, POPULOS) — 24/09/2026 09:14\n> Aprovo para a Solaris Energia: engajamento em fases (phased), com Fase 1 de assessment e desenho contratada e Fase 2 de implantação opcional. Aprovo também: as licenças Akamai serão fornecidas pela POPULOS por meio de revenda autorizada. E aprovo a garantia: a POPULOS corrigirá defeitos diretamente atribuíveis aos serviços executados por 90 dias corridos após o aceite de cada fase."
  },
  "sla": {
   "state": "commitment",
   "basis": "populos_standard",
   "value": "Tabela institucional de SLA da POPULOS",
   "source": "institutional-standards.json",
   "template_version": "2026.09.24-1"
  },
  "sla_applicability": {
   "state": "commitment",
   "value": [
    "implementation"
   ],
   "approved_value": [
    "implementation"
   ],
   "source": "E-mail de Vitor (Executivo de Contas, POPULOS) de 24/09/2026 09:20",
   "approved_by": "Vitor",
   "approved_at": "2026-09-24",
   "approval_record": "E-mail de Vitor (Executivo de Contas, POPULOS) de 24/09/2026 09:20",
   "mode": "test",
   "engagement_ref": "phased",
   "approval_quote": "Vitor (Executivo de Contas, POPULOS) — 24/09/2026 09:20\n> Sobre o SLA da Solaris Energia, aprovo: a tabela institucional de SLA da POPULOS se aplica somente à Fase 2 (implantação). A Fase 1 não tem SLA de atendimento a incidentes.",
   "applies_to_phases": [
    "F2"
   ]
  },
  "fase1_estimate": {
   "state": "commitment",
   "value": "3 a 4 semanas",
   "approved_value": "3 a 4 semanas",
   "source": "E-mail de Ana Ribeiro (Arquiteta, POPULOS) de 24/09/2026 10:02",
   "approved_by": "Ana Ribeiro",
   "approved_at": "2026-09-24",
   "approval_record": "E-mail de Ana Ribeiro (Arquiteta, POPULOS) de 24/09/2026 10:02",
   "mode": "test",
   "engagement_ref": "phased",
   "approval_quote": "Aprovo as estimativas de esforço da Solaris Energia: Fase 1 de 3 a 4 semanas; Fase 2 de 6 a 8 semanas.",
   "approver_role": "arquiteto"
  },
  "fase2_estimate": {
   "state": "commitment",
   "value": "6 a 8 semanas",
   "approved_value": "6 a 8 semanas",
   "source": "E-mail de Ana Ribeiro (Arquiteta, POPULOS) de 24/09/2026 10:02",
   "approved_by": "Ana Ribeiro",
   "approved_at": "2026-09-24",
   "approval_record": "E-mail de Ana Ribeiro (Arquiteta, POPULOS) de 24/09/2026 10:02",
   "mode": "test",
   "engagement_ref": "phased",
   "approval_quote": "Aprovo as estimativas de esforço da Solaris Energia: Fase 1 de 3 a 4 semanas; Fase 2 de 6 a 8 semanas.",
   "approver_role": "arquiteto"
  }
 },
 "discovery": {
  "business_goals": [
   "Manter o portal do cliente e as APIs do app disponíveis durante ataques de negação de serviço na camada de aplicação (REQ-01)",
   "Impedir que robôs testem números de CPF na consulta de débitos (REQ-02)",
   "Automatizar o failover entre o datacenter próprio e a nuvem pública (REQ-03)",
   "Chegar à campanha estadual de renegociação de dívidas de 01/03/2027 com proteção e failover automático em operação (REQ-04)",
   "Decidir a implantação com base em assessment e desenho aprovados (REQ-05)"
  ]
 },
 "traceability": [
  {
   "requirement_id": "REQ-01",
   "requirement": "Proteger o portal do cliente e as APIs usadas pelo app contra DDoS na camada de aplicação, em especial na consulta de débitos",
   "solution": "App & API Protector",
   "evidence": "Indisponibilidade de cerca de 3 horas em junho e em agosto por milhões de requisições na consulta de débitos; o app usa as mesmas APIs do portal",
   "source": "Ata de 22/09/2026, falas de Beatriz (1ª) e Henrique (1ª)",
   "speakers": [
    "client"
   ],
   "hypothesis": false
  },
  {
   "requirement_id": "REQ-02",
   "requirement": "Detectar e bloquear robôs que testam números de CPF na consulta de débitos",
   "solution": "Bot Manager Premier",
   "evidence": "Robôs testando CPFs; a página devolve nome e endereço quando o CPF existe",
   "source": "Ata de 22/09/2026, fala de Henrique (2ª)",
   "speakers": [
    "client"
   ],
   "hypothesis": false
  },
  {
   "requirement_id": "REQ-03",
   "requirement": "Tornar automático o failover do portal e das APIs entre o datacenter próprio e a nuvem pública",
   "solution": "Global Traffic Management",
   "evidence": "Hoje a nuvem pública só recebe tráfego manualmente quando o datacenter cai",
   "source": "Ata de 22/09/2026, fala de Beatriz (2ª)",
   "speakers": [
    "client"
   ],
   "hypothesis": false
  },
  {
   "requirement_id": "REQ-04",
   "requirement": "Estar protegido e com failover automático antes de 01/03/2027, início da campanha estadual de renegociação de dívidas",
   "solution": "Plano de prontidão para a campanha e sequência Fase 1 e Fase 2",
   "evidence": "Na última campanha o tráfego do portal triplicou",
   "source": "Ata de 22/09/2026, fala de Beatriz (3ª)",
   "speakers": [
    "client"
   ],
   "hypothesis": false
  },
  {
   "requirement_id": "REQ-05",
   "requirement": "Realizar assessment e desenho antes de contratar a implantação",
   "solution": "Fase 1 contratada; Fase 2 opcional após o aceite do desenho",
   "evidence": "A Solaris não quer contratar a implantação às cegas",
   "source": "Ata de 22/09/2026, fala de Beatriz (4ª)",
   "speakers": [
    "client",
    "vendor"
   ],
   "hypothesis": false
  }
 ],
 "source_coverage": [
  {
   "ref": "Ata 22/09/2026, Beatriz (1ª)",
   "statement": "Distribuidora em 3 estados, 4,2 milhões de unidades consumidoras; portal com segunda via, religação e consulta de débitos; app usa as mesmas APIs",
   "status": "coberto",
   "targets": [
    "REQ-01",
    "sumário",
    "dimensionamento"
   ]
  },
  {
   "ref": "Ata 22/09/2026, Henrique (1ª)",
   "statement": "Portal fora do ar cerca de 3 horas em junho e em agosto por DDoS de aplicação na consulta de débitos; sem ataque volumétrico",
   "status": "coberto",
   "targets": [
    "REQ-01",
    "sumário"
   ]
  },
  {
   "ref": "Ata 22/09/2026, Henrique (2ª)",
   "statement": "Robôs testando CPFs na consulta de débitos, com exposição de nome e endereço; tratado com o DPO",
   "status": "coberto",
   "targets": [
    "REQ-02",
    "exclusões"
   ]
  },
  {
   "ref": "Ata 22/09/2026, Beatriz (2ª)",
   "statement": "Duas origens (datacenter principal e nuvem pública) com failover manual; desejo de failover automático",
   "status": "coberto",
   "targets": [
    "REQ-03",
    "dimensionamento"
   ]
  },
  {
   "ref": "Ata 22/09/2026, Beatriz (3ª)",
   "statement": "Campanha de renegociação a partir de 01/03/2027; tráfego triplicou na última campanha",
   "status": "coberto",
   "targets": [
    "REQ-04",
    "dimensionamento"
   ]
  },
  {
   "ref": "Ata 22/09/2026, Henrique (3ª)",
   "statement": "Sem congelamento formal de mudanças; mudanças em produção somente às terças, das 22h às 2h",
   "status": "coberto",
   "targets": [
    "premissas"
   ]
  },
  {
   "ref": "Ata 22/09/2026, Beatriz (4ª)",
   "statement": "Assessment e desenho antes da implantação",
   "status": "coberto",
   "targets": [